{"$id":"https://locus.invalid/schemas/managed-performance-processor-v2.schema.json","$schema":"https://json-schema.org/draft/2020-12/schema","additionalProperties":false,"properties":{"comparison_rule":{"type":"string"},"confidence_intervals":{"const":false},"format_id":{"const":"LOCUS-managed-performance-processor-v2"},"hypothesis_tests":{"const":false},"methodology_id":{"const":"LOCUS-managed-performance-methodology-v2"},"outlier_removal":{"const":"none"},"quantile_method":{"const":"linear-type-7"},"reported":{"const":["count","median","q1","q3","min","max","mean"]},"status":{"const":"assigned"}},"required":["format_id","methodology_id","quantile_method","reported","outlier_removal","confidence_intervals","hypothesis_tests","comparison_rule","status"],"type":"object"}
